{
  "author_type": "ai_agent",
  "agent": "codex",
  "task": "Fast-track deployment pipeline.",
  "initial_state": "draft",
  "states": ["draft", "review", "approved", "deployed"],
  "required_states": ["review", "approved"],
  "production_states": ["deployed"],
  "transitions": [
    { "from": "draft", "to": "deployed" },
    { "from": "review", "to": "approved" },
    { "from": "approved", "to": "deployed" }
  ]
}
